{
  "schema": "osfs-audio-bench/1",
  "kind": "offline-kernel-proxy",
  "disclaimer": "Synthetic sweep rendered offline in Node through the compiled core. Not real-time acceptance, not a device qualification, and no physical output route: dropout count is unknown.",
  "createdUtc": "2026-09-14T09:43:31.941Z",
  "environment": {
    "node": "v26.8.2",
    "platform": "darwin",
    "arch": "arm64",
    "cpu": "Apple M5",
    "logicalCpus": 10
  },
  "inputs": {
    "sweepSha256": "0e4a927e80859f19f9fab923fb547d4aa6073b55e5dd6781ec2fcbf014704389",
    "sweepSeconds": 240,
    "seed": 1397110064,
    "bridge": "none (direct WASM calls)",
    "quantumFrames": 128,
    "cockpitSourceMetres": [
      0,
      0.96,
      -4.06
    ]
  },
  "build": {
    "wasmSha256": "ef9369b6b64cd93fb976ff0a19571de38b3dc0d06fbb5e1d3b6a17b4fe8a4d41",
    "wasmBytes": 42542,
    "emcc": null,
    "flags": [
      "-O3",
      "-std=c++17",
      "--no-entry",
      "-sSTANDALONE_WASM=1",
      "-sALLOW_MEMORY_GROWTH=1",
      "-sINITIAL_MEMORY=2097152",
      "-sSTACK_SIZE=131072",
      "-sMALLOC=emmalloc",
      "-sERROR_ON_UNDEFINED_SYMBOLS=1",
      "-sFILESYSTEM=0",
      "-fno-exceptions",
      "-fno-rtti",
      "-fno-fast-math"
    ]
  },
  "dropouts": {
    "count": null,
    "detector": "none: offline render has no output route"
  },
  "runs": [
    {
      "tier": "off",
      "sampleRate": 44100,
      "pass": "sweep",
      "shed": 0,
      "tireSlipWatts": 0,
      "seconds": 240,
      "quantumMs": 2.9024943310657596,
      "output": {
        "peak": 0,
        "peakWithinLimiterCeiling": true,
        "nonFiniteSamples": 0,
        "rmsBySegment": {
          "off": 0,
          "motoring": 0,
          "light-off-and-idle": 0,
          "acceleration": 0,
          "maximum": 0,
          "deceleration": 0,
          "re-acceleration": 0,
          "exterior-flyby": 0,
          "cruise-config-cycle": 0,
          "windmill": 0,
          "rundown": 0,
          "silence": 0
        }
      },
      "core": {
        "snapshotsIn": 14400,
        "snapshotsDropped": 14336,
        "eventsIn": 6,
        "eventsDropped": 0,
        "resyncs": 0,
        "staleFades": 0,
        "blocks": 0,
        "frames": 0,
        "peak": 0,
        "telemetryAge": 0,
        "activeGrains": 0,
        "grainDrops": 0,
        "nonFinite": 0,
        "queueDepth": 0,
        "fade": 0,
        "doppler": 0,
        "distance": 0,
        "tier": 0,
        "shed": 0,
        "epoch": 1
      },
      "timing": {
        "provenance": "performance.now() around each osfs_audio_process() call in Node; an offline kernel proxy, not AudioWorklet callback timing",
        "proposedP95BudgetMs": 0,
        "repeats": [
          {
            "samples": 82688,
            "meanMs": 0.00002949396526701911,
            "p50Ms": 0.000040999999995960934,
            "p95Ms": 0.00004200000000764703,
            "maxMs": 0.20483399999999818,
            "overQuantumCount": 0,
            "worstRolling2sP95Ms": 0.00016700000000469117,
            "p95OverProposedBudget": null
          },
          {
            "samples": 82688,
            "meanMs": 0.00002574190934593344,
            "p50Ms": 0.00004100000001017179,
            "p95Ms": 0.00004200000000764703,
            "maxMs": 0.0049999999999954525,
            "overQuantumCount": 0,
            "worstRolling2sP95Ms": 0.00008400000000108321,
            "p95OverProposedBudget": null
          },
          {
            "samples": 82688,
            "meanMs": 0.000025054167472963704,
            "p50Ms": 0.00004100000001017179,
            "p95Ms": 0.00004200000000764703,
            "maxMs": 0.0007910000000208584,
            "overQuantumCount": 0,
            "worstRolling2sP95Ms": 0.00008300000001781882,
            "p95OverProposedBudget": null
          }
        ],
        "aggregate": {
          "samples": 248064,
          "meanMs": 0.000026763347361972083,
          "p50Ms": 0.000040999999995960934,
          "p95Ms": 0.00004200000000764703,
          "maxMs": 0.20483399999999818,
          "overQuantumCount": 0,
          "worstRolling2sP95Ms": 0.00016700000000469117,
          "p95OverProposedBudget": null
        }
      }
    },
    {
      "tier": "off",
      "sampleRate": 48000,
      "pass": "sweep",
      "shed": 0,
      "tireSlipWatts": 0,
      "seconds": 240,
      "quantumMs": 2.6666666666666665,
      "output": {
        "peak": 0,
        "peakWithinLimiterCeiling": true,
        "nonFiniteSamples": 0,
        "rmsBySegment": {
          "off": 0,
          "motoring": 0,
          "light-off-and-idle": 0,
          "acceleration": 0,
          "maximum": 0,
          "deceleration": 0,
          "re-acceleration": 0,
          "exterior-flyby": 0,
          "cruise-config-cycle": 0,
          "windmill": 0,
          "rundown": 0,
          "silence": 0
        }
      },
      "core": {
        "snapshotsIn": 14400,
        "snapshotsDropped": 14336,
        "eventsIn": 6,
        "eventsDropped": 0,
        "resyncs": 0,
        "staleFades": 0,
        "blocks": 0,
        "frames": 0,
        "peak": 0,
        "telemetryAge": 0,
        "activeGrains": 0,
        "grainDrops": 0,
        "nonFinite": 0,
        "queueDepth": 0,
        "fade": 0,
        "doppler": 0,
        "distance": 0,
        "tier": 0,
        "shed": 0,
        "epoch": 1
      },
      "timing": {
        "provenance": "performance.now() around each osfs_audio_process() call in Node; an offline kernel proxy, not AudioWorklet callback timing",
        "proposedP95BudgetMs": 0,
        "repeats": [
          {
            "samples": 90000,
            "meanMs": 0.00002534264444445411,
            "p50Ms": 0.00004100000001017179,
            "p95Ms": 0.00004200000000764703,
            "maxMs": 0.012958999999966636,
            "overQuantumCount": 0,
            "worstRolling2sP95Ms": 0.00004200000000764703,
            "p95OverProposedBudget": null
          },
          {
            "samples": 90000,
            "meanMs": 0.000026157866666677718,
            "p50Ms": 0.00004100000001017179,
            "p95Ms": 0.00004200000000764703,
            "maxMs": 0.011124999999992724,
            "overQuantumCount": 0,
            "worstRolling2sP95Ms": 0.00004200000000764703,
            "p95OverProposedBudget": null
          },
          {
            "samples": 90000,
            "meanMs": 0.00002570915555553294,
            "p50Ms": 0.00004100000001017179,
            "p95Ms": 0.00004200000000764703,
            "maxMs": 0.07450000000000045,
            "overQuantumCount": 0,
            "worstRolling2sP95Ms": 0.00004200000000764703,
            "p95OverProposedBudget": null
          }
        ],
        "aggregate": {
          "samples": 270000,
          "meanMs": 0.00002573655555555492,
          "p50Ms": 0.00004100000001017179,
          "p95Ms": 0.00004200000000764703,
          "maxMs": 0.07450000000000045,
          "overQuantumCount": 0,
          "worstRolling2sP95Ms": 0.00004200000000764703,
          "p95OverProposedBudget": null
        }
      }
    },
    {
      "tier": "low",
      "sampleRate": 44100,
      "pass": "sweep",
      "shed": 0,
      "tireSlipWatts": 0,
      "seconds": 240,
      "quantumMs": 2.9024943310657596,
      "output": {
        "peak": 0.05245433747768402,
        "peakWithinLimiterCeiling": true,
        "nonFiniteSamples": 0,
        "rmsBySegment": {
          "off": 0,
          "motoring": 0.0014516134392104235,
          "light-off-and-idle": 0.0029741897536577203,
          "acceleration": 0.00484779253184657,
          "maximum": 0.006519425607256303,
          "deceleration": 0.005111539613805268,
          "re-acceleration": 0.004812531920579114,
          "exterior-flyby": 0.0009195118134628767,
          "cruise-config-cycle": 0.006133536155498263,
          "windmill": 0.00449281853510202,
          "rundown": 0.0029932966802021063,
          "silence": 0.000026777358311189104
        }
      },
      "core": {
        "snapshotsIn": 14400,
        "snapshotsDropped": 0,
        "eventsIn": 6,
        "eventsDropped": 0,
        "resyncs": 0,
        "staleFades": 0,
        "blocks": 82688,
        "frames": 10584000,
        "peak": 0.05245433585595301,
        "telemetryAge": 0,
        "activeGrains": 0,
        "grainDrops": 0,
        "nonFinite": 0,
        "queueDepth": 3,
        "fade": 1,
        "doppler": 1,
        "distance": 4.171953978653168,
        "tier": 1,
        "shed": 0,
        "epoch": 1
      },
      "timing": {
        "provenance": "performance.now() around each osfs_audio_process() call in Node; an offline kernel proxy, not AudioWorklet callback timing",
        "proposedP95BudgetMs": 0.12,
        "repeats": [
          {
            "samples": 82688,
            "meanMs": 0.022338540332332853,
            "p50Ms": 0.02341599999999744,
            "p95Ms": 0.025415999999950145,
            "maxMs": 3.0448750000000473,
            "overQuantumCount": 2,
            "worstRolling2sP95Ms": 0.03491699999995035,
            "p95OverProposedBudget": false
          },
          {
            "samples": 82688,
            "meanMs": 0.02225007606907931,
            "p50Ms": 0.023416999999881227,
            "p95Ms": 0.024958000000424363,
            "maxMs": 3.045082999999977,
            "overQuantumCount": 1,
            "worstRolling2sP95Ms": 0.028874999999970896,
            "p95OverProposedBudget": false
          },
          {
            "samples": 82688,
            "meanMs": 0.022243048785798407,
            "p50Ms": 0.02345900000000256,
            "p95Ms": 0.025000000000545697,
            "maxMs": 3.0808749999996508,
            "overQuantumCount": 2,
            "worstRolling2sP95Ms": 0.030000000000654836,
            "p95OverProposedBudget": false
          }
        ],
        "aggregate": {
          "samples": 248064,
          "meanMs": 0.02227722172907019,